<?xml version="1.0" encoding="UTF-8"?>

<!-- Elemento raÃ­z -->
<!ELEMENT mvc-config (command-mappings)>

<!-- Conjungo de mapeos de comandos -->
<!ELEMENT command-mappings (command)*>

<!-- Comando -->
<!ELEMENT command (forward)*>
<!ATTLIST command
    type CDATA #IMPLIED
    forwardTo CDATA #IMPLIED
    path CDATA #IMPLIED
>

<!ELEMENT forward EMPTY>
<!ATTLIST forward
    path CDATA #IMPLIED
    name CDATA #IMPLIED
>
